date,quote,author
2026-05-30,"Confidence is not a guarantee of success, but a pattern of thinking that will improve your likelihood of success, a tenacious search for ways to make things work.",John Eliot
2026-05-30,"Confidence is not a guarantee of success, but a pattern of thinking that will improve your likelihood of success, a tenacious search for ways to make things work.",John Eliot
2026-05-31,"In a world that is constantly changing, it is to our advantage to learn how to adapt and enjoy something better.",Spencer Johnson
2026-06-01,Continuous effort - not strength or intelligence - is the key to unlocking our potential.,Winston Churchill
2026-06-02,The only thing worse than being blind is having sight but no vision.,Helen Keller
2026-06-03,"You are always your own best guru, your own best teacher, the answers are always inside you.",Sathya Sai Baba
2026-06-04,"Expect the best of yourself, and then do what is necessary to make it a reality.",Ralph Marston
2026-06-05,One of the most difficult things is not to change society - but to change yourself.,Nelson Mandela
2026-06-06,"The man who asks a question is a fool for a minute, the man who does not ask is a fool for life.",Confucius
2026-06-07,A lot of people have gone further than they thought they could because someone else thought they could.,Zig Ziglar
2026-06-08,I like the dreams of the future better than the history of the past.,Thomas Jefferson
2026-06-09,"Given the choice between the experience of pain and nothing, I would choose pain.",William Faulkner
2026-06-10,Short cuts make long delays.,J.R.R. Tolkien
2026-06-11,"Every man desires to live long, but no man wishes to be old.",Jonathan Swift
2026-06-12,The future depends on what you do today.,Mahatma Gandhi
2026-06-13,You can't build a reputation on what you are going to do.,Henry Ford
2026-06-14,"Anger begins with folly, and ends with repentance.",Beverly Sills
2026-06-15,Your dream has to be bigger than your fear.,Steve Harvey
2026-06-16,The road to success is always under construction..,Lily Tomlin
2026-06-17,"Never whine, never complain, never try to justify yourself.",Robert Greene
2026-06-19,All we have to decide is what to do with the time that is given to us.,J.R.R. Tolkien
2026-06-20,Let us rather run the risk of wearing out than rusting out.,Theodore Roosevelt
2026-06-21,Only when you can be extremely pliable and soft can you be extremely hard and strong.,Zen Proverb
2026-06-22,"Argue for your limitations and sure enough, they're yours.",Richard Bach
2026-06-23,"You may be one person in this world, but to one person you may mean the world.",Unknown
2026-06-24,You're on earth. There's no cure for that.,Samuel Beckett
2026-06-25,The best fighter is never angry.,Lao Tzu
2026-06-26,It is dangerous to be right in matters on which the established authorities are wrong.,Voltaire
